1, 2, 3, false, Ты потерял память. Принять вызов НЛО?,Принять вызов, Отклонить вызов,
3, null, null, false, Ты отклонил вызов.Поражение, null, null,
2, 4, 5, false, Ты принял вызов. Поднимаешься на мостик к капитану?, Подняться на мостик, Отказаться подниматься на мостик,
5, null, null, Ты не пошел на переговоры. Поражение, null, null
4, 6, 7, false, Ты поднялся на мостик. Ты кто?, Рассказать правду о себе, Солгать о себе,
7, null, null, false,  Твою ложь разоблачили, null, null,
6, null, null, true,Тебя вернули домой. Победа, null,null,
